Search suggestion,Tool,Goal,Post,Expected Tool,Expected Goal,Expected Post
New baby: how to tell older child?,Media Family Meeting,,Are screens becoming the new babysitter in school?,Prepare the family for a new member,Sibling Relationships,Dealing with jealousy from my oldest since baby arrived
How to set boundaries?,Scenario: Cyberbullying,Stand Up To Bullying!,How do I get my 5-year-old to listen when I try to set boundaries?,Boundaries & Respect Toolkit,Discipline & Boundaries,What are your boundaries in parenting?
How to resolve sibling conflicts?,Scenario: Physical Altercation,Stand Up To Bullying!,Siblings: Navigating the chaos of siblings dynamics,Sibling conflict resolution guide,Sibling Relationships,Sibling rivalry
Is my child being excluded?,My Kid Is Being Bullied,,Is my child defiant (3-year-old)?,Friendship building strategies,Friendships & relationships,I Think My 12-Year-Old Daughter Is Being Excluded
How to support my lonely child?,My Kid Is Being Bullied,,How Can I Help My Child Make Friends?,Supportive communication tips,Friendships & relationships,I Think My 12-Year-Old Daughter Is Being Excluded
Child struggling at school?,Media Family Meeting,,How Can I Help My Child Make Friends?,School success toolkit,Educational Development,School struggles
How much screen-time is too much?,Finding Balance,,How Much screen time is too much?,AAP Screen-Time Guidelines,Master Screen Time,How Much screen time is too much?
Should my child play video games?,Hobby Hunt & Share,,Help with Alex and soccer!,AAP Screen-Time Guidelines,Master Screen Time,At what age did your kid start playing videogames?
Set time limits to kid's devices?,Finding Balance,,Screen Time Battles: How Do You Manage?,Screen-time Pledge Cards,Master Screen Time,Screen Time Battles: How Do You Manage?
How to talk about sex?,Media Family Meeting,Stand Up To Bullying!,How to Talk to My Son About Intimacy? Help!,Sex education guide,Child Development,How to Talk to My Son About Intimacy? Help!
How to talk about sexting?,Media Family Meeting,Stand Up To Bullying!,How to Talk to My Son About Intimacy? Help!,Safe digital practices guide,Child Development,How to Talk to My Son About Intimacy? Help!
How to discipline kids?,Media Family Meeting,Stand Up To Bullying!,How to discipline children?,Positive discipline strategies,Discipline & Boundaries,How to discipline children?
Potty training: what to say?,Scenario: Coming Home Upset,Stand Up To Bullying!,How long does potty training take?,Potty training communication tips,Potty training,"Potty training hopeful, but how long?"
Is my child ready for potty training?,I Suspect My Kid Is Bullying Others,,How long does potty training take?,Potty readiness checklist,Potty training,"Potty training hopeful, but how long?"
How long is potty training?,Physical Bullying: Take Action!,,How long does potty training take?,A Guide to Potty Training,Potty training,How long does potty training take?
How to motivate child for potty?,Scenario: Physical Altercation,,How long does potty training take?,My Potty Tracker,Potty training,"Potty training hopeful, but how long?"
Can I boost self-esteem?,Feelings Matter,,Building confidence in my kids,Goal Setting & Achievement,Confidence & Self-esteem,Building Confidence in My 4-Year-Old
How to raise confident children?,FAQs,Stand Up To Bullying!,Trying to raise empathetic children!,Self-esteem boosting activities,Confidence & Self-esteem,Building Confidence in My 4-Year-Old
How to stop tantrums?,Recognize Bullying Behavior,,How to stop tantrums?,Mirror My Calm,Become an expert in Tantrums,How to stop tantrums?
How to prevent tantrums?,My Child Is Bullying Others,,Help with Tantrums - My Son Just Won’t Calm Down,Tantrum Chat,Become an expert in Tantrums,How to control tantrums?
What causes tantrums?,Tantrum Chat,Become An Expert In Tantrums,Double tantrums,Tantrum triggers toolkit,Become an expert in Tantrums,Tell me about your toddler’s worst tantrum
Why kids have tantrums?,I Suspect My Kid Is Bullying Others,Become An Expert In Tantrums,Why does my house turn into a reality show when my in-laws visit?,Tantrums 101,Become an expert in Tantrums,How to control tantrums?
How to manage tantrums?,Mirror My Calm,,Help! My 3-Year-Old's Tantrums Are Getting Out of Hand,Feelings Matter,Become an expert in Tantrums,How to control tantrums?
How to stay calm during tantrums?,Mirror My Calm,,Help with Tantrums - My Son Just Won’t Calm Down,Calm & Collected,Become an expert in Tantrums,Help with Tantrums - My Son Just Won’t Calm Down
What should I say during tantrums?,Media Family Meeting,Become An Expert In Tantrums,Help with Tantrums - My Son Just Won’t Calm Down,Tantrum Chat,Become an expert in Tantrums,How to control tantrums?
Why does my child bite others?,I Suspect My Kid Is Bullying Others,,Struggling to Teach Empathy,Biting behavior intervention guide,Toddler Behavior,"I have a biter, send help!"
How to help child sleep better?,Media Family Meeting,,Sleep Worries (6 Month Baby),Sleep improvement tools,Sleep,Sleep Worries (6 Month Baby)
What are the signs of anxiety?,Recognize Bullying Behavior,,What are your boundaries in parenting?,Anxiety signs checklist,Big Emotions,My anxious teen. I’m starting to worry
How to calm anxious child?,Physical Altercation: Bad Conversation,Stand Up To Bullying!,Help with Tantrums - My Son Just Won’t Calm Down,Anxiety relief strategies,Big Emotions,My anxious teen. I’m starting to worry
Why do my kids keep fighting?,My Kid Is Being Bullied,,How to Talk to My Son About Intimacy? Help!,Sibling conflict resolution guide,Friendships & relationships,Sibling rivalry
Should I punish my child?,My Kid Is Being Bullied,,Is my child defiant (3-year-old)?,Positive discipline toolkit,Discipline & Boundaries,What do we think of “time out”?
Are time outs harmful?,Screen-Free Adventure Jar,Master Screen Time,"What do we think of ""time out""?",Mirror My Calm,Discipline & Boundaries,What do we think of “time out”?
How to parent a teen?,FAQs,Stand Up To Bullying!,How do I help my kids with social skills?,Teen parenting survival guide,Child Development,Navigating the Teen Transition
Want to boost son's self-confidence?,Feelings Matter,Stand Up To Bullying!,Building confidence in my kids,My Superpower,Confidence & Self-esteem,Building Confidence in My 4-Year-Old
How to help with rejection?,Media Family Meeting,Stand Up To Bullying!,How to Talk to My Son About Intimacy? Help!,Rejection coping toolkit,Friendships & relationships,I Think My 12-Year-Old Daughter Is Being Excluded
How does social media affect kids?,Media Family Meeting,,Why does my house turn into a reality show when my in-laws visit?,Media Family Meeting,Master Screen Time,When to give a smartphone to kids?
How to help siblings get along?,Scenario: Cyberbullying,,Getting My Kids to Help Around the House,Sibling conflict resolution guide,Friendships & relationships,Sibling rivalry
Prepare child for new sibling?,FAQs,,Co-Parenting Without the Drama?,Prepare the family for a new member,Friendships & relationships,Dealing with jealousy from my oldest since baby arrived
Supporting kids through divorce?,My Kid Is Being Bullied,,Co-Parenting Without the Drama?,Divorce support toolkit,Divorce,Co-Parenting Without the Drama?
What is bullying?,Scenario: Coming Home Upset,Stand Up To Bullying!,"My 10-Year-Old is Being Bullied, and I Don’t Know What to Do",Understanding bullying,Stand Up To Bullying!,Advice on bullying?
Signs my child is bullying others?,Recognize Bullying Behavior,,How to help my child with learning difficulties?,I suspect my kid is bullying others,Stand Up To Bullying!,Has anyone ever found out that your child is a bully and if so what did you do ?
Is my child being bullied?,My Kid Is Being Bullied,,Is my child defiant (3-year-old)?,I suspect my kid is being bullied,Stand Up To Bullying!,Is my third grader being bullied? Help!
What to do if child is a bully?,My Kid Is Being Bullied,Stand Up To Bullying!,Is my third grader being bullied? Help!,I suspect my kid is bullying others,Stand Up To Bullying!,What would you do if you found out your child was a bully?
Can I prevent my child from bullying?,I Suspect My Kid Is Bullying Others,Stand Up To Bullying!,Bear hugs gone too far,Spot the Signs of Bullying,Stand Up To Bullying!,"Parents of Bullies, what did you do to stop yoir child from being a bully."
How to stop cyberbullying?,Scenario: Cyberbullying,Stand Up To Bullying!,How to stop tantrums?,Cyberbullying: Take Action!,Stand Up To Bullying!,Cyberbullying is more of a problem than we think.
What if my child doesn't like sports?,My Kid Is Being Bullied,,How to help my child with learning difficulties?,Non-sport physical activities guide,Self-awareness,"My boy is not into sports, should I do something about it?"
School related stress,Screen Time Pledge Cards,,School Stress—Feeling Overwhelmed,School anxiety coping techniques,Educational Development,School struggles
Is my child ready for social media?,Screen Time Pledge Cards,,How do I help my kids with social skills?,Media Family Meeting,Master Screen Time,What are your best back-to-school tips?
When to give my child a phone?,My Kid Is Being Bullied,Stand Up To Bullying!,When to give a smartphone to kids?,AAP Screen-Time Guidelines,Master Screen Time,When to give a smartphone to kids?
Is there educational screen-time?,Screen-Free Adventure Jar,,How Much screen time is too much?,AAP Screen-Time Guidelines,Master Screen Time,When to give a smartphone to kids?
How to balance screen time and activities?,Media Family Meeting,Master Screen Time,"TV overload, How much is too much?",Screen-Free Challenge,Master Screen Time,Screen Time Battles: How Do You Manage?
How to ensure child's online safety?,Scenario: Cyberbullying,,How to help my child with learning difficulties?,AAP Screen-Time Guidelines,Master Screen Time,Which tools are the best for internet safety for kids?
Why is screen-time bad?,Physical Altercation: Bad Conversation,,Paw Patrol is taking over my TV!,Finding Balance,Master Screen Time,How Much screen time is too much?
Is my child internet addicted?,My Kid Is Being Bullied,,Is my child defiant (3-year-old)?,Media Family Meeting,Master Screen Time,How Much screen time is too much?
How to raise grateful kids?,Media Family Meeting,Stand Up To Bullying!,Trying to raise empathetic children!,Gratitude-building toolkit,Gratitude,Tips for Teaching Gratitude to Little Ones?
What to avoid during tantrums?,Verbal Bullying: Take Action!,,"My 10-Year-Old is Being Bullied, and I Don’t Know What to Do",Tantrum Insight,Become an expert in Tantrums,How to stop tantrums?
Why won't my child leave my side?,FAQs,,Struggling to Teach Empathy,Independence building strategies,Child Development,Over-attached daughter?
Is my baby hitting milestones?,My Kid Is Being Bullied,,How do you capture your baby’s milestones,Baby milestone tracker,Child Development,How do you capture your baby’s milestones
How to develop secure attachment?,My Child Is Bullying Others,Stand Up To Bullying!,How do I help my kids with social skills?,Attachment-building strategies,Child Development,Over-attached daughter?
